title,author,description,isbn,published_at
"1Q84","Haruki Murakami","A complex and surreal narrative...","9784103534259","2009-05-29"
"The Devotion of Suspect X","Keigo Higashino","A detective story about...","9784163271392","2005-08-25"
"Kitchen","Banana Yoshimoto","A novella about love, loss...","9784101235059","1988-01-30"
"Battle Royale","Koushun Takami","A dystopian novel where...","9784167110017","1999-04-22"
"The Wind-Up Bird Chronicle","Haruki Murakami","A surrealist novel that...","9784061848689","1994-04-12"